{"$defs":{"BinaryWireV1":{"additionalProperties":false,"properties":{"byte_length":{"format":"uint64","minimum":0,"type":"integer"},"data":{"type":"string"},"encoding":{"type":"string"}},"required":["encoding","data","byte_length"],"type":"object"},"ReplacementWireV1":{"additionalProperties":false,"properties":{"end":{"format":"uint64","minimum":0,"type":"integer"},"replacement":{"$ref":"#/$defs/BinaryWireV1"},"start":{"format":"uint64","minimum":0,"type":"integer"}},"required":["start","end","replacement"],"type":"object"}},"$id":"schemas/evidentrail/v1/transformation_receipt.schema.json","$schema":"https://json-schema.org/draft/2020-12/schema","additionalProperties":false,"properties":{"contract":{"const":"evidentrail.transformation_receipt","type":"string"},"contract_version":{"const":1,"format":"uint16","maximum":9007199254740991,"minimum":0,"type":"integer"},"input_length":{"format":"uint64","maximum":9007199254740991,"minimum":0,"type":"integer"},"operations":{"items":{"$ref":"#/$defs/ReplacementWireV1"},"maxItems":256,"type":"array"},"output_content_hash":{"pattern":"^sha256_[0-9a-f]{64}$","type":"string"},"output_length":{"format":"uint64","maximum":9007199254740991,"minimum":0,"type":"integer"},"output_payload_length":{"format":"uint64","maximum":9007199254740991,"minimum":0,"type":"integer"},"output_terminator_length":{"format":"uint64","minimum":0,"type":["integer","null"]},"policy_digest":{"pattern":"^policy_sha256_[0-9a-f]{64}$","type":"string"},"resulting_event_id":{"pattern":"^evt_[0-9a-f]{64}$","type":"string"},"transformation_receipt_id":{"pattern":"^txrcpt_[0-9a-f]{64}$","type":"string"}},"required":["contract","contract_version","transformation_receipt_id","policy_digest","operations","input_length","output_length","output_content_hash","output_payload_length","resulting_event_id"],"title":"evidentrail.transformation_receipt","type":"object"}