{"contract":"evidentrail.transformation_receipt","contract_version":1,"input_length":0,"operations":[],"output_content_hash":"sha256_0000000000000000000000000000000000000000000000000000000000000000","output_length":0,"output_payload_length":0,"output_terminator_length":null,"policy_digest":"policy_sha256_0000000000000000000000000000000000000000000000000000000000000000","resulting_event_id":"evt_0000000000000000000000000000000000000000000000000000000000000000","transformation_receipt_id":"txrcpt_0000000000000000000000000000000000000000000000000000000000000000"}